{
 "id": "weapon.maza-a-dos-manos",
 "name": "Maza a dos manos",
 "kind": "weapon",
 "group": "Armas cuerpo a cuerpo marciales",
 "table": "Armas",
 "fields": {
  "Nombre": "Maza a dos manos",
  "Daño": "2d6 contundente",
  "Propiedades": "A dos manos, pesada",
  "Maestría": "Derribar",
  "Peso": "5 kg",
  "Precio": "10 po"
 },
 "source": {
  "book": "SRD 5.2.1 es",
  "page": 99
 },
 "weight": {
  "raw": "5 kg",
  "kg": 5.0
 },
 "price": {
  "raw": "10 po",
  "amount": 10.0,
  "coin": "po",
  "gp": 10.0
 }
}