{
 "id": "gear.aljaba",
 "name": "Aljaba",
 "kind": "gear",
 "group": null,
 "table": "Equipo de aventureros",
 "fields": {
  "Objeto": "Aljaba",
  "Peso": "0,5 kg",
  "Precio": "1 po"
 },
 "source": {
  "book": "SRD 5.2.1 es",
  "page": 103
 },
 "weight": {
  "raw": "0,5 kg",
  "kg": 0.5
 },
 "price": {
  "raw": "1 po",
  "amount": 1.0,
  "coin": "po",
  "gp": 1.0
 },
 "text": "En una aljaba caben hasta 20 flechas.",
 "blocks": [
  {
   "type": "paragraph",
   "page": 104,
   "md": "En una aljaba caben hasta 20 flechas.",
   "text": "En una aljaba caben hasta 20 flechas."
  }
 ],
 "descriptionPage": 104
}