{
 "id": "gear.linterna-de-ojo-de-buey",
 "name": "Linterna de ojo de buey",
 "kind": "gear",
 "group": null,
 "table": "Equipo de aventureros",
 "fields": {
  "Objeto": "Linterna de ojo de buey",
  "Peso": "1 kg",
  "Precio": "10 po"
 },
 "source": {
  "book": "SRD 5.2.1 es",
  "page": 103
 },
 "weight": {
  "raw": "1 kg",
  "kg": 1.0
 },
 "price": {
  "raw": "10 po",
  "amount": 10.0,
  "coin": "po",
  "gp": 10.0
 },
 "text": "Una linterna de ojo de buey quema aceite como combustible para emitir luz brillante en un cono de 18 m y luz tenue 18 m más allá.",
 "blocks": [
  {
   "type": "paragraph",
   "page": 106,
   "md": "Una linterna de ojo de buey quema aceite como combustible para emitir luz brillante en un cono de 18 m y luz tenue 18 m más allá.",
   "text": "Una linterna de ojo de buey quema aceite como combustible para emitir luz brillante en un cono de 18 m y luz tenue 18 m más allá."
  }
 ],
 "descriptionPage": 106
}