{
 "id": "gear.silbato-de-supervivencia",
 "name": "Silbato de supervivencia",
 "kind": "gear",
 "group": null,
 "table": "Equipo de aventureros",
 "fields": {
  "Objeto": "Silbato de supervivencia",
  "Peso": "—",
  "Precio": "5 pc"
 },
 "source": {
  "book": "SRD 5.2.1 es",
  "page": 103
 },
 "price": {
  "raw": "5 pc",
  "amount": 5.0,
  "coin": "pc",
  "gp": 0.05
 },
 "text": "Cuando se sopla como acción de utilizar, un silbato de supervivencia produce un sonido que se puede oír a 180 m de distancia.",
 "blocks": [
  {
   "type": "paragraph",
   "page": 108,
   "md": "Cuando se sopla como acción de utilizar, un silbato de supervivencia produce un sonido que se puede oír a 180 m de distancia.",
   "text": "Cuando se sopla como acción de utilizar, un silbato de supervivencia produce un sonido que se puede oír a 180 m de distancia."
  }
 ],
 "descriptionPage": 108
}