{
 "id": "weapon.dardo",
 "name": "Dardo",
 "kind": "weapon",
 "group": "Armas a distancia sencillas",
 "table": "Armas",
 "fields": {
  "Nombre": "Dardo",
  "Daño": "1d4 perforante",
  "Propiedades": "Arrojadizo (alcance 6/18), sutil",
  "Maestría": "Molestar",
  "Peso": "125 g",
  "Precio": "5 pc"
 },
 "source": {
  "book": "SRD 5.2.1 es",
  "page": 99
 },
 "price": {
  "raw": "5 pc",
  "amount": 5.0,
  "coin": "pc",
  "gp": 0.05
 }
}