{
 "id": "weapon.maza",
 "name": "Maza",
 "kind": "weapon",
 "group": "Armas cuerpo a cuerpo sencillas",
 "table": "Armas",
 "fields": {
  "Nombre": "Maza",
  "Daño": "1d6 contundente",
  "Propiedades": "—",
  "Maestría": "Debilitar",
  "Peso": "2 kg",
  "Precio": "5 po"
 },
 "source": {
  "book": "SRD 5.2.1 es",
  "page": 99
 },
 "weight": {
  "raw": "2 kg",
  "kg": 2.0
 },
 "price": {
  "raw": "5 po",
  "amount": 5.0,
  "coin": "po",
  "gp": 5.0
 }
}