{
 "id": "vehicle.umbral-de-dano",
 "name": "Umbral de daño",
 "kind": "vehicle",
 "group": "Vehículos grandes",
 "text": "Si un vehículo tiene un umbral de daño (consulta el capítulo “Glosario de reglas”), aparecerá en la tabla.",
 "blocks": [
  {
   "type": "paragraph",
   "page": 109,
   "md": "Si un vehículo tiene un umbral de daño (consulta el capítulo “Glosario de reglas”), aparecerá en la tabla.",
   "text": "Si un vehículo tiene un umbral de daño (consulta el capítulo “Glosario de reglas”), aparecerá en la tabla."
  },
  {
   "type": "table",
   "page": 110,
   "caption": "Vehículos acuáticos y aéreos",
   "header": [
    "Vehículo",
    "Velocidad",
    "Tripulación",
    "Pasajeros",
    "Cargamento (toneladas)",
    "CA",
    "PG",
    "Umbral de daño",
    "Precio"
   ],
   "rows": [
    [
     "Aeronave",
     "12 km/h",
     "10",
     "20",
     "1",
     "13",
     "300",
     "—",
     "40 000 po"
    ],
    [
     "Barcaza",
     "1,5 km/h",
     "1",
     "6",
     "1/2",
     "15",
     "100",
     "10",
     "3000 po"
    ],
    [
     "Bote de remos",
     "2,4 km/h",
     "1",
     "3",
     "—",
     "11",
     "50",
     "—",
     "50 po"
    ],
    [
     "Drakkar",
     "4,5 km/h",
     "40",
     "150",
     "10",
     "15",
     "300",
     "15",
     "10 000 po"
    ],
    [
     "Galera",
     "6 km/h",
     "80",
     "—",
     "150",
     "15",
     "500",
     "20",
     "30 000 po"
    ],
    [
     "Navío de guerra",
     "4 km/h",
     "60",
     "60",
     "200",
     "15",
     "500",
     "20",
     "25 000 po"
    ],
    [
     "Velero",
     "3 km/h",
     "20",
     "20",
     "100",
     "15",
     "300",
     "15",
     "10 000 po"
    ]
   ]
  }
 ],
 "source": {
  "book": "SRD 5.2.1 es",
  "page": 109
 }
}