{
 "id": "weapon.cimitarra",
 "name": "Cimitarra",
 "kind": "weapon",
 "group": "Armas cuerpo a cuerpo marciales",
 "table": "Armas",
 "fields": {
  "Nombre": "Cimitarra",
  "Daño": "1d6 cortante",
  "Propiedades": "Ligera, sutil",
  "Maestría": "Mellar",
  "Peso": "1,5 kg",
  "Precio": "25 po"
 },
 "source": {
  "book": "SRD 5.2.1 es",
  "page": 99
 },
 "weight": {
  "raw": "1,5 kg",
  "kg": 1.5
 },
 "price": {
  "raw": "25 po",
  "amount": 25.0,
  "coin": "po",
  "gp": 25.0
 }
}