{
 "id": "gear.petate",
 "name": "Petate",
 "kind": "gear",
 "group": null,
 "table": "Equipo de aventureros",
 "fields": {
  "Objeto": "Petate",
  "Peso": "3,5 kg",
  "Precio": "1 po"
 },
 "source": {
  "book": "SRD 5.2.1 es",
  "page": 103
 },
 "weight": {
  "raw": "3,5 kg",
  "kg": 3.5
 },
 "price": {
  "raw": "1 po",
  "amount": 1.0,
  "coin": "po",
  "gp": 1.0
 },
 "text": "En un petate puede dormir una criatura Pequeña o Mediana. Mientras estés en un petate, superarás automáticamente las tiradas de salvación contra el frío extremo (consulta el capítulo “Herramientas del juego”).",
 "blocks": [
  {
   "type": "paragraph",
   "page": 107,
   "md": "En un petate puede dormir una criatura Pequeña o Mediana. Mientras estés en un petate, superarás automáticamente las tiradas de salvación contra el frío extremo (consulta el capítulo “Herramientas del juego”).",
   "text": "En un petate puede dormir una criatura Pequeña o Mediana. Mientras estés en un petate, superarás automáticamente las tiradas de salvación contra el frío extremo (consulta el capítulo “Herramientas del juego”)."
  }
 ],
 "descriptionPage": 107
}