{
 "id": "armor.camisa-de-malla",
 "name": "Camisa de malla",
 "kind": "armor",
 "group": "Armaduras medias (5 minutos para ponérselas y 1 minuto para quitárselas)",
 "table": "Armaduras",
 "fields": {
  "Armadura": "Camisa de malla",
  "Clase de armadura (CA)": "13 + modificador por Des (máx. 2)",
  "Fuerza": "—",
  "Sigilo": "—",
  "Peso": "10 kg",
  "Precio": "50 po"
 },
 "source": {
  "book": "SRD 5.2.1 es",
  "page": 100
 },
 "weight": {
  "raw": "10 kg",
  "kg": 10.0
 },
 "price": {
  "raw": "50 po",
  "amount": 50.0,
  "coin": "po",
  "gp": 50.0
 }
}