{
 "id": "gear.pergamino",
 "name": "Pergamino",
 "kind": "gear",
 "group": null,
 "table": "Equipo de aventureros",
 "fields": {
  "Objeto": "Pergamino",
  "Peso": "—",
  "Precio": "1 pp"
 },
 "source": {
  "book": "SRD 5.2.1 es",
  "page": 103
 },
 "price": {
  "raw": "1 pp",
  "amount": 1.0,
  "coin": "pp",
  "gp": 0.1
 },
 "text": "En una hoja de pergamino caben unas 250 palabras escritas a mano.",
 "blocks": [
  {
   "type": "paragraph",
   "page": 107,
   "md": "En una hoja de pergamino caben unas 250 palabras escritas a mano.",
   "text": "En una hoja de pergamino caben unas 250 palabras escritas a mano."
  }
 ],
 "descriptionPage": 107
}