{
 "id": "tool.herramientas-de-ladron",
 "name": "Herramientas de ladrón",
 "kind": "tool",
 "group": "Otras herramientas",
 "text": "Característica: Destreza Peso: 0,5 kg\n\nUtilizar: forzar una cerradura (CD 15) o desarmar una trampa (CD 15)",
 "blocks": [
  {
   "type": "property",
   "page": 102,
   "md": "**Característica:** Destreza **Peso:** 0,5 kg",
   "text": "Característica: Destreza Peso: 0,5 kg"
  },
  {
   "type": "property",
   "page": 102,
   "md": "**Utilizar:** forzar una cerradura (CD 15) o desarmar una trampa (CD 15)",
   "text": "Utilizar: forzar una cerradura (CD 15) o desarmar una trampa (CD 15)"
  }
 ],
 "source": {
  "book": "SRD 5.2.1 es",
  "page": 102
 },
 "price": {
  "raw": "25 po",
  "amount": 25.0,
  "coin": "po",
  "gp": 25.0
 }
}