{
 "id": "ammunition.dardos",
 "name": "Dardos",
 "kind": "ammunition",
 "group": null,
 "table": "Munición",
 "fields": {
  "Tipo": "Dardos",
  "Cantidad": "50",
  "Recipiente": "Bolsa",
  "Peso": "0,5 kg",
  "Precio": "1 po"
 },
 "source": {
  "book": "SRD 5.2.1 es",
  "page": 106
 },
 "weight": {
  "raw": "0,5 kg",
  "kg": 0.5
 },
 "price": {
  "raw": "1 po",
  "amount": 1.0,
  "coin": "po",
  "gp": 1.0
 }
}